rubric,date,url,link,title,text,autor
5,2021-05-03,https://www.kommersant.ru/archive/rubric/5/day/2021-05-03,https://kommersant.ru/doc/4800620,ОБСЕ советует избегать маркировки СМИ «иностранными агентами»,"Страны—участницы Организации по безопасности и сотрудничеству в Европе (ОБСЕ) должны воздержаться от стигматизации СМИ, в том числе с помощью их маркирования как «иностранных агентов», считает представитель ОБСЕ по вопросам свободы СМИ Тереза Рибейру. Об этом говорится в ее коммюнике о праве прессы свободно вести журналистскую деятельность. Документ опубликован в честь Всемирного дня свободы печати, отмечающегося 3 мая. Коммюнике посвящено правам СМИ «свободно собирать, сообщать и распространять информацию, новости и мнения, независимо от государственных границ». По мнению госпожи Рибейру, ограничение свободы выражения мнения для СМИ «должно иметь важные основания, чтобы быть оправданными». Представитель ОБСЕ считает, что факт наличия финансовых связей между СМИ или их работниками и какой-либо структурой в другой стране «не может служить законным основанием для их стигматизации, например, путем маркирования их как ""иностранных агентов"" и возложения на них дополнительного административного бремени». «Точно так же сам факт того, что средства массовой информации, имеющие связи с различными структурами за границей, распространяют нежелательные сообщения, не может служить законной причиной для предотвращения его или ее работы»,— говорится в документе. По мнению Терезы Рибейру, ограничения в отношении СМИ «всегда должны быть крайней мерой». В случаях, когда эти ограничения накладываются, у СМИ должен быть доступ к «средствам правовой защиты в рамках функционирующей и независимой судебной системы». «Ограничение свободы средств массовой информации ради политической целесообразности часто приводит к цензуре. Однажды начав, цензуру уже трудно остановить»,— подчеркивает представитель ОБСЕ. В числе других рекомендаций для стран-участниц организации: позволять СМИ осуществлять журналистскую деятельность за границей; способствовать более широкому обсуждению и развитию открытой, разнообразной и динамичной среды СМИ, в том числе по вопросам, которые они считают «чужеземными» или «неверными»; разрешать въезд работникам СМИ и информационным агентствам из других стран (в том числе тем, которые передают или распространяют сообщения, которые «власти считают нежелательными»);  чиновникам — «воздерживаться от запугивания, угроз или попустительства», осуждать насилие в отношении журналистов, в том числе в иностранных;  применять к прибывающим в страну зарубежным СМИ те же стандарты и возможные ограничения, что и для своих средств массовой информации.  23 апреля 2021 года в список иноагентов включили издание «Медуза», ставшее вторым крупным русскоязычным СМИ после «Радио Свобода», оказавшимся в этом списке. Теперь зарегистрированное в Латвии издание обязано создать юрлицо в России, а каждое свое сообщение маркировать информацией о статусе иноагента. Из-за этого у издания начались финансовые проблемы. Действия российских властей осудил ЕС. Кремль считает решение Минюста РФ законным. 30 апреля Владимир Путин подписал закон о штрафах за распространение материалов СМИ-иноагента без указания статуса. С какими трудностями может столкнуться «Медуза», читайте в публикации “Ъ” «Загоргонили ""Медузу""».",NaN
5,2021-05-03,https://www.kommersant.ru/archive/rubric/5/day/2021-05-03,https://kommersant.ru/doc/4800617,Генпрокуратура Армении завела дело о двойном гражданстве президента,"Армянская Генпрокуратура завела уголовное дело о сокрытии двойного гражданства президентом страны Арменом Саркисяном, сообщил председатель Союза адвокатов Армении Ара Зограбян. Согласно закону, для участия в выборах президента Армении нужно в течение последних шести лет иметь только армянское гражданство. «Хочу напомнить, что 53 адвоката подали заявление о преступлении, связанном с сокрытием факта двойного гражданства президента Армении Армена Саркисяна. Специальная следственная служба (ССС) отказалась возбуждать уголовное дело на основании заявления, представленного адвокатами. Сообщаю, что Генпрокуратура отменила решение ССС и возбудила уголовное дело по ст. 325 ч. 1 УК Армении (фальсификация, сбыт или использование документов)»,— написал господин Зограбян в Facebook (перевод по ТАСС). Армена Саркисяна избрали президентом Армении 2 марта 2018 года. Адвокаты заявляют, что его участие в выборах было незаконным, поскольку с 2003 по 2012 год он имел гражданство Великобритании.",NaN
5,2021-05-03,https://www.kommersant.ru/archive/rubric/5/day/2021-05-03,https://kommersant.ru/doc/4800610,В Сирии определились с кандидатами на пост президента,"Высший конституционный суд Сирии назвал имена трех кандидатов, допущенных к участию в президентских выборах, которые намечены на 26 мая. Это действующий президент Башар Асад, экс-министр по делам Народного совета (парламента) Сирии Абдалла Саллюм Абдалла и представитель оппозиции Махмуд Ахмед Мараи. «Приняты заявления на участие кандидатами в президенты на всеобщих выборах от трех граждан, остальные заявки отклонены, так как они не соответствуют конституционным и правовым нормам»,— заявил в понедельник председатель Высшего конституционного суда Сирии Мухаммад Ляхам. Он также добавил, что те, кто получил отказ, могут оспорить решение суда в течение трех дней. Согласно конституции, для Башара Асада, в чьей победе на выборах мало кто сомневается, этот президентский срок должен стать последним. Его соперники — оба юристы по образованию и формально представляют силы, никак не связанные с правящей партией Арабского социалистического возрождения («Баас»). Абдалла Саллюм Абдалла родился в 1956 году в городе Азаз провинции Алеппо. Он стал первым кандидатом, направившим заявку на участие в выборах. Господин Абдалла — член политбюро Социалистической юнионистской партии, был депутатом Народного совета, а в 2016–2020 годах министром по делам этого совета. Махмуд Ахмед Мараи родился в 1957 году в Каламуне — пригороде Дамаска. Он возглавляет Сирийскую арабскую организацию по правам человека, а также занимает пост генсека «Демократического фронта оппозиции», созданный в декабре 2016 года. В него вошли несколько партий, в том числе официально зарегистрированные, однако внутри страны о них мало кто знает. Господин Мараи принимал участие в переговорах в Женеве как представитель внутренней (не эмигрировавшей) оппозиции, в 2014 и 2015 годах был в составе делегации оппозиции приезжал в Москву. Впрочем, инициированную Россией работу сирийского Конституционного комитета он не принял, заранее предсказав ее провал. «Башар Асад пытается получить легитимность для выборов если не в глазах международного сообщества, то хотя бы среди сирийцев. Среди его последних шагов — объявленная накануне амнистия, в ходе которой на свободу вышли несколько журналистов и оппозиционеров, теперь к выборам допущен представитель внутренней оппозиции, хотя все это не более чем игра, да и оппозиция эта весьма условная»,— сказал “Ъ” сирийский политолог Самер Элиас. Всего заявки на участие в выборах подал 51 человек, среди них семь женщин. Для регистрации в качестве кандидатов им нужно было заручиться поддержкой как минимум 35 депутатов парламента. Однако с учетом того, что у «Баас» 167 мест, пройти в финал помимо Башара Асада смогли только два кандидата.  Претендовать на пост президента Сирии могут граждане республики от 40 лет и старше, проживающие на родине последние десять лет и не имеющие иностранного паспорта. Это автоматически отсекает от участия в выборах представителей внешней оппозиции, тем более проголосовать за рубежом в посольствах 20 мая смогут только те сирийцы, кто официально стоит на учете в димписсиях. Оппозиция и большинство беженцев к таковым не относятся. Впрочем, внешняя оппозиция заранее назвала предстоящее голосование фарсом. «Все кандидаты — ингредиенты основного блюда. Их цель — содействовать успеху Башара Асада»,— сказал “Ъ” официальный представитель делегации оппозиции на переговорах в Астане Айман аль-Асими. По его словам, только те выборы, которые будут способствовать «прекращению деспотического режима в Сирии», могут считаться легитимными в глазах оппозиции. «Выборы должны способствовать политическому решению, но этого не произойдет, если в них не будут участвовать все сирийцы. Эти выборы проходят не на всей сирийской земле, сирийский народ не свободен в своем выборе»,— подчеркнул он. Господин аль-Асими также отметил, что вопрос о выборах стал «частью разногласий между Россией и международным сообществом». Представитель считает, что Москва хочет показать, что именно она контролирует ситуацию в Сирии. Предстоящие выборы не считают легитимными также США, Великобритания, Франция, Германия, Италия и Турция. «Выборы, лишившие почти 7 млн сирийцев избирательного права, далеко не являющиеся свободными и справедливыми, не могут считаться легитимными международным сообществом»,— заявил в конце апреля МИД Турции. А постпред США при ООН Линда Томас-Гринфилд назвала предстоящие выборы «обманом». В Москве с такой позицией не согласны.  «Расцениваем прозвучавшие на днях из столиц ряда иностранных государств заявления о якобы нелегитимности предстоящих выборов как элемент грубого политического давления на Дамаск и очередную попытку вмешательства во внутренние дела Сирийской Арабской Республики. Никто не вправе указывать сирийцам, когда и при каких условиях они должны избирать главу своего государства»,— заявили в ведомстве. Москва планирует направить на выборы своих наблюдателей в ответ на приглашение сирийских парламентариев. Помимо России приглашения также получили депутаты законодательных органов Алжира, Армении, Белоруссии, Боливии, Венесуэлы, Ирана, Китая, Кубы, Мавритании, Никарагуа, Омана, Эквадора и ЮАР.",Марианна Беленькая
5,2021-05-03,https://www.kommersant.ru/archive/rubric/5/day/2021-05-03,https://kommersant.ru/doc/4800615,Правозащитники: в апреле в Белоруссии более 200 человек осудили за протесты,"В апреле не менее 210 человек в Белоруссии осудили по административным делам, связанным с протестами, сообщил правозащитный центр «Весна». Массовые протесты в стране начались в августе 2020 года после президентских выборов, победителем которых ЦИК объявил Александра Лукашенко. Сам он утверждал, что акциями управляют из-за рубежа. По данным правозащитников «Весны», из  210 в апреле 68 человек были оштрафованы на общую сумму 111 215 белорусских рублей (более 3,2 млн российских рублей). Под арест попал 131 человека, им назначен срок от пять до 30 суток. Дела не менее 20 человек отправлены на доработку или прекращены за истечением срока давности. В этом году в Белоруссии решили ужесточить правила проведения массовых акций, а также закон о противодействии экстремизму. Одна из мер — запрет освещать в СМИ несанкционированные митинги. Оппозиция уверена, что эти шаги «легализуют репрессии и нарушают права человека».  Подробнее о ситуации в стране читайте в материале “Ъ” «У Александра Лукашенко борьба не дура».",NaN
5,2021-05-03,https://www.kommersant.ru/archive/rubric/5/day/2021-05-03,https://kommersant.ru/doc/4800609,Вакцинация не освободит туристов в ЕС от карантина и ПЦР-тестов,"В Еврокомиссии (ЕК) пояснили, что предложение разрешить въезд в ЕС вакцинированным иностранным туристам не исключает необходимости для приезжих сдавать ПЦР-тесты и проходить карантин. ЕК предложила разрешить въезд на территорию ЕС иностранцам, которые минимум за две недели до этого прошли вакцинацию от COVID-19 одним из одобренных в ЕС препаратов.  «Наше предложение предусматривает возможность въезда в ЕС, однако оно не предписывает странам ЕС освобождать этих людей от действующих эпидемиологических мер, в частности карантина или ПЦР-тестов»,— пояснил на брифинге официальный представитель ЕК Адальберт Янс (цитата по ТАСС). Сейчас в ЕС одобрены четыре вакцины: от компаний AstraZeneca, Pfizer/BioNTech, Moderna и Johnson & Johnson. Российская вакцина «Спутник V» пока проходит проверку европейского регулятора. Кроме того, в Европе хотят ввести единый паспорт вакцинации, образец которого представили в марте. Документ будет содержать данные о прививках, недавнем отрицательном результате ПЦР-теста на COVID-19 и об антителах после перенесенного заболевания. Смогут ли страны ЕС одобрять вакцины сами, читайте в материале “Ъ FM” «COVI-PASS станет окном в Европу».",NaN
5,2021-05-03,https://www.kommersant.ru/archive/rubric/5/day/2021-05-03,https://kommersant.ru/doc/4800603,ЕС вызвал постпреда России из-за санкций против европейских чиновников,"Постоянного представителя России при Евросоюзе Владимира Чижова вызвали для разговора с главой внешнеполитической службы ЕС. Господину Чижову хотят выразить решительный протест в связи с введенными на прошлой неделе санкциями против восьми европейских чиновников, сообщил официальный представитель внешнеполитической службы ЕС Питер Стано. «Вызван российский постпред, во второй половине дня он должен быть принят генеральным секретарем Еврокомиссии и европейской внешнеполитической службы, где мы выразим ему резкое осуждение и возражение»,— заявил на брифинге господин Стано (цитата по Reuters). Он добавил, что министры иностранных дел ЕС на совещании 10 мая обсудят ответ на российские санкции. 30 апреля МИД РФ сообщил о внесении в черный список восьми граждан Евросоюза, в том числе представителей официальных структур ЕС. Им закрыт въезд на территорию России. Решение принято в ответ на санкции ЕС, введенные в марте. 2 марта США и ЕС ввели санкции из-за дела оппозиционера Алексея Навального, 22 марта — за нарушение прав человека. Подробнее о санкциях — в материале “Ъ” «""Санкции против России ставят под вопрос какое-либо взаимодействие""».",NaN
