rubric,date,url,link,title,text,autor
5,2021-05-06,https://www.kommersant.ru/archive/rubric/5/day/2021-05-06,https://kommersant.ru/doc/4801764,В столице Мальдив ввели комендантский час из-за коронавируса,"Власти Мальдив ввели в столичном районе Большой Мале комендантский час с 21:00 до 4:00 по местному времени (19:00 и 2:00 мск). Мера введена в целях борьбы с коронавирусом. Мальдивы остаются одним из немногих курортных направлений, доступных для российских туристов в условиях ограничений. «Для сдерживания распространения COVID-19 с 21:00 до 4:00 будет введен комендантский час в районе Большого Мале (Мале, Хулхумале, Виллимале) начиная с сегодняшнего дня (6 мая 2021 г.). Полиция продолжит выдавать разрешения на доставку и другие необходимые услуги»,— сообщило в Twitter местное управление по охране здоровья (Health Protection Agency, HPA). По данным Ассоциации туроператоров России (АТОР), россияне находятся на втором месте по турпотоку на Мальдивские острова, уступая только отдыхающим из Индии. В конце апреля Мальдивы разрешили въезд без GWH-теста привившимся российской вакциной от COVID-19 «Спутник V». О перспективе роста цен на авиабилеты в связи с пандемией — в материале “Ъ FM” «Цены на авиабилеты рискуют взмыть вверх».",NaN
5,2021-05-06,https://www.kommersant.ru/archive/rubric/5/day/2021-05-06,https://kommersant.ru/doc/4801746,Зеленский заявил о сохранении угрозы со стороны России,"Президент Украины Владимир Зеленский сообщил, что от границ с Украиной, в том числе в Крыму, было отведено только 3,5 тыс. российских военных. 75 тыс. военнослужащих, по мнению главы Украины, остаются на границе. Господин Зеленский видит в этом угрозу нападения. «Мы отмечаем — и наша разведка, и наши профессиональные военные — мы видим только 3,5 тыс. военных, которые начали отведение и ушли с территории временно оккупированного полуострова Крым. Больше нигде мы пока что уменьшения не видим. Считаем, что уменьшение это медленное и потому вероятная угроза (нападения.— “Ъ”) может быть»,— сказал Владимир Зеленский на совместной с госсекретарем США Энтони Блинкеном пресс-конференции в Киеве (цитата по «Интерфаксу»). Он добавил, что вдоль границ с Украиной находятся порядка 75 тыс. российских военных и техники. «Мы наблюдаем за этими событиями очень тщательно, и мы видим, как реагирует Украина, начиная с захвата Крыма и войны на Донбассе. И мы видим, что на границе с Украиной сейчас есть концентрация российских сил, самая большая с 2014 года»,— сказал госсекретарь. Госсекретарь США прибыл с двухдневным визитом в Киев в среду вечером. В повестке переговоров с украинскими властями — вопросы реформ и сотрудничества в сфере безопасности. Почему в России растет потребление нелегальных сигарет — в материале “Ъ” «Российскую угрозу поделили на семь».",NaN
5,2021-05-06,https://www.kommersant.ru/archive/rubric/5/day/2021-05-06,https://kommersant.ru/doc/4801731,"ЕС пригласил США, Канаду и Норвегию к участию в оборонной программе","Евросоюз пригласил США, Канаду и Норвегию к участию в военной программе Постоянного структурированного сотрудничества в сфере безопасности и обороны (PESCO), говорится в заявлении Совета ЕС. Программа направлена на расширение оперативных возможностей по развертыванию сил. «В ответ на просьбы Канады, Норвегии и Соединенных Штатов Америки об участии в проекте PESCO ""Военная мобильность"" Совет сегодня принял позитивные решения, уполномочивающие координатора этого проекта — Нидерланды — пригласить эти три страны. Канада, Норвегия и Соединенные Штаты Америки станут первыми не входящими в сообщество государствами, которым будет предложено принять участие в проекте PESCO»,— сказано в заявлении (цитата по ТАСС). PESCO была утверждена Евросоюзом в 2017 году. В программе участвуют 25 стран ЕС. Целью программы является усиление координации и согласованности действий между странами Европы, сотрудничество в сфере безопасности, развитие обороноспособности и другие.",NaN
5,2021-05-06,https://www.kommersant.ru/archive/rubric/5/day/2021-05-06,https://kommersant.ru/doc/4801716,Лавров заявил о «мании безнаказанности» у Евросоюза,"Министр иностранных дел России Сергей Лавров заявил о «мании безнаказанности» ЕС в вопросе антироссийских санкций. Он заявил, что Россия не оставит подобные выпады без ответа. «То, что Евросоюз заявил о нелегитимности и отсутствии международной правовой обоснованности наших действий, означает лишь одно: что Евросоюз считает, что ему все дозволено. И когда Евросоюз начинает угрожать нам новыми санкциями, я просто начинаю уже думать, что помимо вот этого ощущения вседозволенности и непогрешимости ЕС начинает быть обуреваем еще одной манией — имею в виду полную безнаказанность»,— сказал господин Лавров на пресс-конференции по итогам визита в Армению (цитата по «РИА Новости»). 30 апреля Россия внесла в черный список восемь граждан стран Евросоюза, в том числе представителей официальных структур ЕС. Решение связано с введенными 2 и 22 марта антироссийскими санкциями. Европейская сторона назвала последние санкции России необоснованными и политически мотивированными.  2 марта США и ЕС ввели персональные антироссийские санкции из-за дела оппозиционера Алексея Навального. Под ограничения попали высокопоставленные должностные лица России, научные организации и компании. 22 марта ЕС ввел санкции против двух чеченцев за нарушение прав человека. Подробнее о мартовских санкциях — в материале “Ъ” «У санкций два союзника — США и ЕС».",NaN
5,2021-05-06,https://www.kommersant.ru/archive/rubric/5/day/2021-05-06,https://kommersant.ru/doc/4801699,Пескову неизвестно о работе Петрова и Боширова на Кремль,"Пресс-секретарь президента Дмитрий Песков заявил, что ему неизвестно о работе на Кремль Александра Петрова и Руслана Боширова. Ранее об этом сообщил журналист Bellingcat Христо Грозев. Господин Песков отметил, что в Кремле «работать невозможно», потому что это историческое здание.  «Нет, честно говоря, я такой информацией не располагаю. Но в целом в Кремле работать невозможно. Кремль — это историческое здание, наследие ЮНЕСКО. В нем располагается резиденция президента РФ и подразделение администрации президента»,— ответил господин Песков на вопрос журналистов. «Мне также неизвестно, что они могут работать в администрации президента. Не думаю, в администрации нет подразделения, которое занимается спортивным питанием»,— добавил пресс-секретарь президента (цитата по «РИА Новости»). Ранее журналист-расследователь Bellingcat Христо Грозев заявил чешскому изданию Novinky.cz, что Александр Петров и Руслан Боширов получили новую работу на госслужбе, потому что больше не могут работать шпионами. Он назвал их важными представителями Кремля. Журналист пообещал в ближайшее время опубликовать подробную информацию об этом. Христо Грозев был одним из авторов расследования об отравлении Алексея Навального. Он утверждал, что оно походило на отравление Сергея и Юлии Скрипалей. Напомним, в 2018 году Александр Петров и Руслан Боширов обвинялись властями Великобритании в отравлении экс-сотрудника ГРУ Сергея Скрипаля и его дочери Юлии. Сами они утверждали, что в город Солсбери приезжали в туристических целях, а работают в фитнес-индустрии. 17 апреля 2021 года Чехия обвинила Россию в причастности к взрыву. Тогда же полиция страны объявила в розыск предполагаемых сотрудников ГРУ Боширова и Петрова. За обвинениями последовала высылка Чехией российских дипломатов. О развитии дела — в материале “Ъ” «Отголоски чешских взрывов ищут в Болгарии».",NaN
5,2021-05-06,https://www.kommersant.ru/archive/rubric/5/day/2021-05-06,https://kommersant.ru/doc/4801690,Песков: место встречи Путина и Байдена пока не определено,"Место, где может пройти встреча президентов России и США Владимира Путина и Джо Байдена, все еще не определено, сообщил пресс-секретарь президента РФ Дмитрий Песков. Потенциальная встреча лидеров двух стран обсуждается с середины апреля. Американское издание Politico ранее назвало возможными местами встречи Рейкьявик, Прагу, Любляну и Баку. «Нет. По возможной встрече по-прежнему рассказать не о чем»,— ответил Дмитрий Песков агентству ТАСС на вопрос, определен ли уже широкий список возможных площадок или конкретный город для организации этого саммита. Президент США предложил Владимиру Путину провести личную встречу в ходе телефонного разговора 13 апреля. Джо Байден надеется, что мероприятие пройдет в июне в Европе. В качестве места встречи администрация Белого дома предложила третью страну. Власти Австрии предложили провести встречу в Вене. Кремль заявил, что официального ответа по поводу встречи не было, Москва изучает предложение. О том, как новый глава Белого дома готовится к встрече,— в материале “Ъ” «Джо Байден устарел на сто дней».",NaN
5,2021-05-06,https://www.kommersant.ru/archive/rubric/5/day/2021-05-06,https://kommersant.ru/doc/4801686,Госсекретарь США надеется на более стабильные отношения с Россией,"Госсекретарь США Энтони Блинкен заявил, что Соединенные Штаты готовы ответить на агрессивные действия со стороны России, хотя и «предпочли бы более стабильные и предсказуемые отношения». По словам господина Блинкена, если Москва выберет «путь сотрудничества», это будет выгодно обеим сторонам. «Если Россия будет вести себя безответственно или агрессивно, как это было в случае с кибератакой на Solar Winds, вмешательством в наши выборы и с тем, что Россия сделала с Навальным, то мы ответим… Но в то же время мы предпочли бы более стабильные и предсказуемые отношения, и если Россия выберет этот путь, то у нас есть области, в которых мы можем сотрудничать к взаимной выгоде»,— сказал Энтони Блинкен в интервью BBC. Комментируя вопрос строительства российского трубопровода «Северный поток-2», господин Блинкен сослался на позицию американского президента Джо Байдена. «Президент уже давно ясно заявляет, он заявлял это и до того, как стал президентом, что этот трубопровод — плохая идея. Он продвигает интересы России, подрывает интересы Европы и противоречит самим принципам ЕС относительно энергетической безопасности... и, конечно, он вредит интересам Польши, Украины и других ключевых европейских стран»,— сказал госсекретарь США. Ранее Энтони Блинкен принял участие в первой после начала пандемии очной встрече главы МИДов стран «группы семи» (G7) в Лондоне. Встреча G7 началась с жесткой риторики в адрес России, однако закончилась признанием неготовности вступать в новый конфликт. В среду вечером госсекретарь США прибыл с двухдневным визитом в Киев. Подробности — в материале “Ъ” «Российскую угрозу поделили на семь».",NaN
5,2021-05-06,https://www.kommersant.ru/archive/rubric/5/day/2021-05-06,https://kommersant.ru/doc/4801537,Европа осторожно открывается,"Как объявили на этой неделе власти Евросоюза, вакцинацию в ЕС прошли уже более 150 млн человек. Сейчас хотя бы первую дозу одной из доступных прививок получил каждый четвертый европеец, к июлю число вакцинированных планируется нарастить до двух третей. По мере приближения курортного сезона и разворачивания массовой прививочной кампании многие европейские страны постепенно отказываются от введенных ранее коронавирусных ограничений — как для собственных граждан, так и для туристов. К первым числам мая хотя бы одну порцию вакцины получили 30% населения ЕС — об этом на неделе объявил Европейский центр профилактики и контроля заболеваемости. Лучше всех с вакцинацией справляется Венгрия, где первую прививку сделали уже более половины жителей, а обе — более 25% населения. В тройку лидеров по доле населения, принявшего участие в вакцинации, также вошли Мальта и Финляндия. В лидерах по количеству сделанных прививок — Германия: хотя бы одну дозу препарата там получили уже более 30 из 83 млн населения, и ежедневно удается прививать до 1 млн человек. Правда, и в ФРГ власти дают понять, что окончательно с ограничениями придется проститься нескоро: отменены и знаменитый Октоберфест, и традиционная Мюнхенская конференция по безопасности. Тем не менее в стране активно обсуждают возможности поощрения тех, кто уже получил обе дозы вакцины или переболел. Соответствующий законопроект подготовило на этой неделе Министерство здравоохранения. А в экспериментальном порядке ограничения на передвижение и социальные контакты для привитых и переболевших уже с сегодняшнего дня снимаются в Баварии. В Италии, где власти стремятся к планке в полмиллиона вакцинированных в день, также надеются за месяц полностью привить более половины населения. Осторожно смягчают карантин и другие страны. К июлю планируется отменить практически все ограничения во Франции — о четырех этапах послаблений в конце прошлой недели объявил президент республики Эмманюэль Макрон. А летом, возможно, отменят даже обязательные к ношению медицинские маски. В Польше, где уровень заболеваемости упал до минимума с начала февраля этого года, на этой неделе открывают торговые центры и музеи, затем в половину заполняемости — отели, на следующем этапе — веранды кафе и ресторанов. В Дании школьники средних классов выйдут на учебу уже на этой неделе. «Пандемия спровоцировала беспрецедентный кризис для туристического сектора. Аренда гостиниц в Европейском союзе снизилась на 50% в 2020 году, а трансграничный туризм пережил резкое падение — примерно на 70%. Кризис затронул миллионы рабочих мест, и очевидно, что от него пострадало столько же семей»,— напомнил еврокомиссар по внутреннему рынку Тьерри Бретон. Как и многие в руководстве ФРГ, он видит выход в том, чтобы поощрять «безопасный» туризм (для тех, кто уже переболел или привился) и продолжать ограничивать «опасный». Уже через месяц в ЕС, как ожидается, будут введены единые прививочные сертификаты — электронные документы с указанием информации о проведенной вакцинации, сделанном ПЦР-тесте или перенесенном заболевании. Некоторыми послаблениями могут воспользоваться и российские туристы. С 12 мая возобновляют работу визовые центры Испании в РФ. А Греция еще в конце апреля отменила карантин для россиян, при условии что у них на руках есть и сертификат о вакцинации, и отрицательный ПЦР-тест. Правда, въехать в страну можно по-прежнему через один из разрешенных аэропортов, и существует риск не уложиться в квоту в 4 тыс. туристов из РФ в неделю — но уже с середины мая это ограничение могут снять. С 10 мая прошедшие полный курс вакцинации — в том числе «Спутником V» — смогут без ограничений въехать и на Кипр, где до 9 мая сохраняется режим локдауна с комендантским часом и закрытыми магазинами. Как сообщил журналистам заместитель гендиректора РЖД Дмитрий Пегов, в компании надеются уже летом вернуть в расписание пассажирские поезда между РФ и Финляндией.",Галина Дудина
