rubric,date,url,link,title,text,autor
5,2021-05-09,https://www.kommersant.ru/archive/rubric/5/day/2021-05-09,https://kommersant.ru/doc/4802494,Израиль нанес удар по военному посту ХАМАС в ответ на атаку из сектора Газа,"Армия Израиля нанесла удар по военному посту ХАМАС на юге сектора Газа. Так военные ответили на запуск ракеты с территории сектора Газа.  «Сегодня вечером террористы выпустили ракету в сторону Израиля из Газы. В ответ наш самолет только что нанес удар по военному посту ХАМАС на юге Газы»,— говорится в сообщении армии Израиля в Twitter.  «Ближневосточный квартет» (Россия, США, ЕС и ООН) ранее выразил озабоченность актами насилия в Восточном Иерусалиме — там в ходе столкновений пострадали около 300 человек. «Квартет» также выразил обеспокоенность запуском ракет и воздушных шаров с зажигательной смесью из сектора Газа в направлении Израиля. О напряженности в регионе — в материале “Ъ” «Новая битва за Иерусалим».",NaN
5,2021-05-09,https://www.kommersant.ru/archive/rubric/5/day/2021-05-09,https://kommersant.ru/doc/4802493,Две женщины и ребенок пострадали при стрельбе на Таймс-сквер,"На Таймс-сквер в Нью-Йорке произошла стрельба. Пострадали две женщины и четырехлетняя девочка. По информации полиции, они оказались случайными прохожими, которые получили ранения в ходе конфликта других людей. Подозреваемый пока не задержан, сообщил начальник управления городской полиции Дермот Ши на пресс-конференции. Полиция распространила видеозапись с предполагаемым преступником. «Виновные в этом бессмысленном насилии будут найдены и полиция Нью-Йорка привлечет их к ответственности»,— написал мэр Нью-Йорка Билл де Блазио в Twitter. Угрозы жизням пострадавших нет. Ребенку делают операцию. В конфликте были замешаны несколько человек. Как минимум у одного из них было оружие. На месте происшествия обнаружили три гильзы.",NaN
5,2021-05-09,https://www.kommersant.ru/archive/rubric/5/day/2021-05-09,https://kommersant.ru/doc/4802487,Лейборист Садик Хан переизбран мэром Лондона,"Мэр Лондона Садик Хан победил на выборах главы города. 50-летний лейборист по итогам второго раунда набрал 55,2% голосов, а его основной конкурент, консерватор Шон Бэйли — 44,8%. «Спасибо, Лондон. Для меня честь служить городу, который я люблю, еще три года»,— написал мэр в Twitter. Победа господина Хана была прогнозируемой. Но, как отмечает The Guardian, опросы показывали его более уверенную победу в первом раунде. Садик Хан в 2016 году стал первым мусульманином во главе мэрии европейской столицы. Выборы должны были пройти в 2020 году, но их перенесли из-за пандемии.",NaN
5,2021-05-09,https://www.kommersant.ru/archive/rubric/5/day/2021-05-09,https://kommersant.ru/doc/4802481,80 человек пострадали в столкновениях в Иерусалиме,"В столкновениях израильской полиции и палестинцев пострадали 80 человек, сообщил палестинский Красный полумесяц. За два дня ранения получили около 300 человек. 14 человек были госпитализированы. Среди пострадавших есть несовершеннолетние. Пострадавшие получили ранения резиновыми пулями и светошумовыми гранатами. Накануне в результате столкновений в Восточном Иерусалиме пострадали больше 200 человек. Около 90 из них были госпитализированы. «Ближневосточный квартет» (Россия, США, ЕС и ООН) выразил озабоченность актами насилия в Восточном Иерусалиме. Он призвал власти Израиля проявить сдержанность, а стороны конфликта — «соблюдать и уважать статус-кво святых мест». О напряженности в регионе — в материале “Ъ” «Новая битва за Иерусалим».",NaN
5,2021-05-09,https://www.kommersant.ru/archive/rubric/5/day/2021-05-09,https://kommersant.ru/doc/4802480,ВМС США сообщили об изъятии оружия российского производства с корабля в Аравийском море,"Крейсер Monterey ВМС США в ходе проверки изъял оружие с судна без опознавательных знаков в Аравийском море, сообщил Пятый флот ВМС США. На корабле находились противотанковые управляемые ракеты российского производства и другое оружие. Будет проводиться расследование о пункте доставки груза. «Среди найденного оружия были десятки современных противотанковых управляемых ракет российского производства, тысячи китайских штурмовых винтовок Type 56 и сотни пулеметов ПКМ, снайперские винтовки, противотанковые гранатометы»,— говорится в сообщении Пятого флота ВМС США.  https://twitter.com/USNavy/status/1391166783042768896 Также на корабле нашли усовершенствованные оптические прицелы. Операция по изъятию оружия проводилась два дня. Экипаж судна отпустили после допроса.",NaN
5,2021-05-09,https://www.kommersant.ru/archive/rubric/5/day/2021-05-09,https://kommersant.ru/doc/4802479,Президент Латвии считает Вторую мировую «чужой войной»,"Президент Латвии Эгилс Левитс считает, что Латвия не принимала участие во Второй мировой войне, а разгром нацизма «не принес освобождения». Он назвал войну чужой.  «8 мая мы поминаем жертв Второй мировой войны. Латвия не принимала участие во Второй мировой войне, для нас это была чужая война. Наши парни были призваны в армии в обе из воюющих сторон, они воевали за свои цели в составе чужих армий, и у нас было очень много гражданских жертв»,— сказал президент журналистам после возложения цветов на Братском кладбище в Риге (цитата по «РИА Новости»).  Господин Левитс заявил, что эта дата для Латвии «не несет освобождения», но страна солидарна и «радуется вместе с датчанами, норвежцами, нидерландцами, бельгийцами, французами и другими народами Европы, которым эта дата несет освобождение». «К сожалению, мы помним и то, что в Латвии одна оккупационная власть с окончанием войны была сменена другой»,— сказал президент Латвии. В мае 2020 года президенты Эстонии, Латвии и Литвы  обвинили Россию в искажении истории Второй мировой войны. Они заявили, что после ее окончания население Центральной и Восточной Европы не получило свободу. После этого президент России Владимир Путин назвал бредом обвинения СССР в подготовке и развязывании Второй мировой войны. По его мнению, у России нет и не может быть чувства вины за это.",NaN
5,2021-05-09,https://www.kommersant.ru/archive/rubric/5/day/2021-05-09,https://kommersant.ru/doc/4802478,Несколько человек пострадали при стрельбе в торговом центре во Флориде,"В торговом центре Aventura Mall в Авентуре (штат Флорида, США) произошла стрельба. По данным полиции, пострадали трое. Спасатели сообщили о пяти раненых.  «У нас несколько подозреваемых под стражей... Три человека получили ранения, не угрожающие жизни, их лечат в местных больницах»,— говорится в сообщении полиции города Авентура. Aventura Mall — самый крупный торговый центр во Флориде. Авентура находится примерно в 30 км от Майами.",NaN
5,2021-05-09,https://www.kommersant.ru/archive/rubric/5/day/2021-05-09,https://kommersant.ru/doc/4802477,"Россия, США, ЕС и ООН выразили озабоченность насилием в Иерусалиме","«Ближневосточный квартет» (Россия, США, ЕС и ООН) выразил озабоченность актами насилия в Восточном Иерусалиме. Он призвал власти Израиля проявить сдержанность, а стороны конфликта — «соблюдать и уважать статус-кво святых мест». 8 мая прошли консультации спецпредставителей «квартета». По их итогам было сделано совместное заявление. Оно опубликовано на сайте МИД России. «Участники ""квартета"" выражают глубокую озабоченность в связи с происходящими на ежедневной основе актами насилия в Восточном Иерусалиме, в частности с имевшими место прошлой ночью на Храмовой горе столкновениями между палестинцами и сотрудниками израильских служб безопасности»,— говорится в заявлении.  Спецпредставители обеспокоены провокационными заявлениями «некоторых политических сил», запуском ракет и воздушных шаров с зажигательной смесью из сектора Газа в направлении Израиля и нападениями на фермерские хозяйства на Западном берегу. Также они отметили обеспокоенность возможным выселением «палестинских семей из мест их исконного проживания — кварталов Шейх Джаррах и Сильван в Восточном Иерусалиме». Квартет призвал отказаться от односторонних шагов, которые «лишь усугубят и без того напряженную ситуацию».  «Руководство обеих сторон несет ответственность за противодействие экстремистам, а также любым проявлениям насилия и подстрекательств. В данном контексте ""квартет"" подтверждает приверженность достижению ""двухгосударственного"" урегулирования через переговоры»,— говорится в заявлении. Накануне в результате столкновений в Восточном Иерусалиме пострадали больше 200 человек. Около 90 из них были госпитализированы. В ночь на воскресенье пострадали больше 50 человек. О напряженности в регионе — в материале “Ъ” «Новая битва за Иерусалим».",NaN
5,2021-05-09,https://www.kommersant.ru/archive/rubric/5/day/2021-05-09,https://kommersant.ru/doc/4802476,Бывший главнокомандующий НАТО ожидает «провокаций» России в Черном море,"Адмирал ВМС США в отставке и бывший главнокомандующий НАТО Джеймс Ставридис описал возможные столкновения России и Украины. По его мнению, Москва может начать провокации в Черном море. Он считает, что даже если НАТО готово будет поддержать Украину, то не сможет сделать это достаточно быстро. «Но никто не должен расслабляться: Путин не из тех, кто будет отступать. Так где же ожидать следующей провокации? Скорее всего, в водах Черного моря»,— написал господин Ставридис для Bloomberg. По мнению адмирала ВМС США в отставке, Россия может использовать для наступления быстроходные патрульные катера с крылатыми ракетами класса «поверхность-поверхность» и «земля-земля», вертолеты для переброски спецназа с десантных кораблей и дизельные подводные лодки. Также он ожидает кибератак со стороны России. «Русские сокрушат украинцев, и НАТО, даже если захочет, не сможет оказаться там достаточно быстро»,— считает господин Ставридис. Он отмечает, что Украина не подпадает под гарантию безопасности НАТО, которая гласит, что «нападение на одного — это нападение на всех».       В апреле США сообщали, что Россия сосредоточила на границе с Украиной больше сил, чем когда-либо с 2014 года,— более 100 тыс. военных. Передислокацию войск Москва объясняла учениями. 22 апреля Минобороны РФ объявило об окончании проверок боеготовности армии и об отводе военных в места постоянной дислокации.  О том, какие угрозы со стороны России видит Украина и США,— в материале “Ъ” «""Россия в состоянии за довольно короткое время приступить к агрессивным действиям""».",NaN
5,2021-05-09,https://www.kommersant.ru/archive/rubric/5/day/2021-05-09,https://kommersant.ru/doc/4802475,Центр по примирению сторон сообщил о нападении около 20 террористов на сирийских военных,"Около 20 боевиков террористической группировки «Хайат Тахрир Аш-Шам» (запрещена в России) напали на позиции правительственных сил Сирии. Об этом сообщил замруководителя российского Центра по примирению враждующих сторон в Сирии контр-адмирал Александр Карпов. Атака была отражена, убиты 10 боевиков.  «В районе населенного пункта Мелладжа провинции Идлиб отряд боевиков иностранного происхождения из состава террористической группировки ""Хайат Тахрир Аш-Шам"" численностью около 20 человек совершил нападение на позиции правительственных сил Сирийской Арабской Республики. Подразделениями сирийских вооруженных сил атака террористов была отражена»,— сказал господин Карпов на брифинге. Его слова приводит пресс-служба. Остальные боевики отступили. О пострадавших среди сирийских военных не сообщается.  Центр по примирению сторон также сообщил, что в Сирии за последние сутки зарегистрировано 52 обстрела со стороны позиций террористической группировки «Джабхат ан-Нусра» (организация запрещена в России).",NaN
5,2021-05-10,https://www.kommersant.ru/archive/rubric/5/day/2021-05-10,https://kommersant.ru/doc/4802855,Около 20 человек погибли при обстрелах Израиля по сектору Газа,"В результате ударов Израиля по сектору Газа погибли по меньшей мере 20 палестинцев, сообщает агентство Wafa со ссылкой на данные министерства здравоохранения сектора Газа. Ранее израильский беспилотник выпустил не менее 45 ракет по группе людей на востоке Бейт-Хануна в ответ на пуски ракет из сектора Газа.  По информации Минздрава, среди 20 погибших девять детей. Еще 65 человек получили ранения, трое пострадавших находятся в критическом состоянии. В середине апреля в Иерусалиме начались столкновения между палестинцами и израильскими силами безопасности. Ситуация обострилась из-за запрета израильской полиции собираться на ступенях у Дамасских ворот Старого города, где в Рамадан проводили время арабские жители. Еще одной причиной массовых беспорядков стало решение израильского суда о выселении нескольких арабских семей из квартала Шейх-Джаррах в Иерусалиме. Подробнее о конфликте в регионе — в материале “Ъ” «В Израиле наступил день Акса».",NaN
