rubric,date,url,link,title,text,autor
5,2021-05-01,https://www.kommersant.ru/archive/rubric/5/day/2021-05-01,https://kommersant.ru/doc/4800358,Боррель назвал неприемлемыми ответные санкции России против чиновников ЕС,"Глава европейской дипломатии Жозеп Боррель считает санкции России против восьми чиновников Евросоюза неприемлемыми, безосновательными и необоснованными. Россия 30 апреля запретила въезд восьми гражданам стран ЕС в ответ на включение в санкционный список шести российских граждан.  «Действия России не помешают ЕС продолжать отстаивать права человека, демократию и международное право, а также привлекать к ответственности виновных в нарушениях прав человека. Это решение, прямо направленное против ЕС и его государств-членов, неприемлемо, лишено каких-либо юридических оснований и необоснованно»,— говорится в заявлении господина Борреля.  По мнению Брюсселя, Россия таким образом «избрала путь конфронтации вместо того, чтобы стремиться переломить негативную траекторию» двусторонних отношений. Господин Боррель выразил солидарность людям из санкционного списка России. Под ограничения Москвы попали председатель Европарламента Давид Сассоли, зампред Европейской комиссии по вопросам ценностей и транспарентности Вера Юрова и другие чиновники. ЕС ранее заявил, что оставляет за собой право принять ответные меры. Ограничения, введенные Россией, стали реакцией на санкции ЕС против нескольких высокопоставленных должностных лиц России по делу Алексея Навального.  Подробнее о санкциях Брюсселя читайте в публикации “Ъ” «У санкций два союзника — США и ЕС».",NaN
5,2021-05-01,https://www.kommersant.ru/archive/rubric/5/day/2021-05-01,https://kommersant.ru/doc/4800356,Монголия получила партию вакцины «Спутник V»,"Партия российской вакцины от коронавируса «Спутник V» прибыла в Монголию, сообщает Российский фонд прямых инвестиций (РФПИ). «""Спутник V"" прибыл в Монголию сегодня!» — говорится в сообщении в Twitter. https://twitter.com/sputnikvaccine/status/1388546465702809602 Минздрав Монголии зарегистрировал «Спутник V» в начале февраля. Решение о регистрации в этой стране было принято по ускоренной процедуре без проведения дополнительных клинических исследований на территории государства. Локальным партнером РФПИ выступила фармацевтическая компания Mongol Emimpex Concern LLC. «Спутник V» был зарегистрирован в России в августе 2020 года. Сейчас вакцина одобрена в 64 странах.",NaN
5,2021-05-01,https://www.kommersant.ru/archive/rubric/5/day/2021-05-01,https://kommersant.ru/doc/4800349,Представитель Ирана сообщил о прогрессе в переговорах по «ядерной сделке»,"Главный переговорщик от Ирана Аббас Арагчи заявил, что темп переговоров по ядерному соглашению «по понятым причинам немного замедлился», но прогресс при этом был. «Когда мы начали писать черновые варианты соглашения, в некоторых областях прогресс, естественно, немного замедлился, однако есть тенденция двигаться вперед»,— цитируют государственные СМИ слова заместителя главы МИД Ирана Аббаса Арагчи после переговоров в Вене (перевод по Reuters).  Ранее совместная комиссия по ядерной сделке с Ираном подвела промежуточные итоги переговоров. Постпред РФ при международных организациях в Вене Михаил Ульянов заявил, что есть основания «для осторожного оптимизма». Переговоры продолжатся в пятницу, 7 мая. Третий раунд диалога по СВПД в отношении ядерной программы Ирана начался в Вене в апреле. По итогам первой недели были сформированы две экспертные группы по ядерным вопросам и отмене антииранских санкций, введенных Вашингтоном. На этой неделе к переговорам присоединилась делегация США.  Подробнее о ядерной программе Ирана читайте в публикации “Ъ” «Иранские центрифурии».",NaN
5,2021-05-01,https://www.kommersant.ru/archive/rubric/5/day/2021-05-01,https://kommersant.ru/doc/4800341,Глава МИД Франции осудил введение Россией санкций против чиновников ЕС,"Министр иностранных дел Франции Жан-Ив Ле Дриан решительно осудил принятые Россией меры против ряда европейских чиновников. Глава МИДа выразил им свою солидарность. «Я решительно осуждаю принятые вчера Россией меры против ряда европейских чиновников, в том числе депутата Жака Мэра (член французской делегации в ПАСЕ.— “Ъ”)»,— написал господин Ле Дриан в Twitter. «Мы ожидаем от России ответственного поведения, которое необходимо для снижения нынешней напряженности»,— отметил он. Россия внесла в черный список восемь граждан стран Евросоюза, в том числе представителей официальных структур ЕС. Решение связано с введенными ранее европейскими антироссийскими санкциями. После ЕС предупредил Россию об ответных мерах на санкции. Напомним, 2 марта США и ЕС ввели персональные антироссийские санкции из-за дела оппозиционера Алексея Навального. Под ограничения попали высокопоставленные должностные лица России, научные организации и компании.  Подробнее читайте в публикации “Ъ” «У санкций два союзника — США и ЕС».",NaN
